{
    "team_name":"GATA HUB",
    "team_logo":"https://s3.amazonaws.com/keybase_processed_uploads/fd84e961633cef5f59f07fc847d56b05_360_360.jpg",
    "contact":{
        "website":"https://gatahub.zone",
        "github":"https://github.com/GATA-HUB",
        "twitter":"https://twitter.com/GataDaoZone",
        "discord":"https://discord.com/invite/4MCrtaCetp"
    },
    "introduction":[
        "Cat brings you the max rewards. Decentralized community-owned public infrastucture, trusted by thousands of delegators with millions of funds. Join GATA family üêæ"
    ],
    "addresses":[
       {
         "osmosis-1":"osmo129k9pj8yk58278q8l6j00azdxfjvz93kp37pak",
         "cosmoshub-4":"cosmos1zy7xyypdwje7w56rdz67pjxtjyk2t4ms5ak23c"
       },
       {
         "osmosis-1":"osmo129k9pj8yk58278q8l6j00azdxfjvz93kp37pak",
         "akashnet-2":"akash182ydqc6grkqyuxqmte4dh40jw4sw32jx2x7dyz"
       },
       {
         "osmosis-1":"osmo129k9pj8yk58278q8l6j00azdxfjvz93kp37pak",
         "teritori-1":"tori1hghqe5k6jj5ll0fl3wg3prandw07q2h2r30xnk"
       },
       {
         "osmosis-1":"osmo129k9pj8yk58278q8l6j00azdxfjvz93kp37pak",
         "stargaze-1":"stars14g6emx2jsv2sl2e5685hmpnvrzcfnzwqfffa0n"
       },
       {
         "osmosis-1":"osmo129k9pj8yk58278q8l6j00azdxfjvz93kp37pak",
         "juno-1":"juno1kqmzy5gph45f57hqdlchqsktk82ntmsxlen2j6"
       },
       {
         "osmosis-1":"osmo129k9pj8yk58278q8l6j00azdxfjvz93kp37pak",
         "omniflixhub-1":"omniflix1tfa6axplvpt0ucsur4zv56a5gq8x6x0nr5z3qa"
       },
       {
         "osmosis-1":"osmo129k9pj8yk58278q8l6j00azdxfjvz93kp37pak",
         "neutron-1":"neutron1uyv59p94h6g9ta2xucrphpu2l5ydce0h5lt7z0"
       },
       {
         "osmosis-1":"osmo129k9pj8yk58278q8l6j00azdxfjvz93kp37pak",
         "stride-1":"stride1texfv73p49gv69rl8wehtn9tnvkt9676564tyh"
       },
       {
         "cosmoshub-4":"cosmos1zy7xyypdwje7w56rdz67pjxtjyk2t4ms5ak23c",
         "neutron-1":"neutron1uyv59p94h6g9ta2xucrphpu2l5ydce0h5lt7z0"
       },
       {
         "cosmoshub-4":"cosmos1zy7xyypdwje7w56rdz67pjxtjyk2t4ms5ak23c",
         "stride-1":"stride1texfv73p49gv69rl8wehtn9tnvkt9676564tyh"
       },
       {
         "cosmoshub-4":"cosmos1zy7xyypdwje7w56rdz67pjxtjyk2t4ms5ak23c",
         "juno-1":"juno1kqmzy5gph45f57hqdlchqsktk82ntmsxlen2j6"
       },
       {
         "cosmoshub-4":"cosmos1zy7xyypdwje7w56rdz67pjxtjyk2t4ms5ak23c",
         "teritori-1":"tori1hghqe5k6jj5ll0fl3wg3prandw07q2h2r30xnk"
       },
       {
         "cosmoshub-4":"cosmos1zy7xyypdwje7w56rdz67pjxtjyk2t4ms5ak23c",
         "omniflixhub-1":"omniflix1tfa6axplvpt0ucsur4zv56a5gq8x6x0nr5z3qa"
       },
       {
         "cosmoshub-4":"cosmos1zy7xyypdwje7w56rdz67pjxtjyk2t4ms5ak23c",
         "akashnet-2":"akash182ydqc6grkqyuxqmte4dh40jw4sw32jx2x7dyz"
       },
       {
         "stride-1":"stride1texfv73p49gv69rl8wehtn9tnvkt9676564tyh",
         "neutron-1":"neutron1uyv59p94h6g9ta2xucrphpu2l5ydce0h5lt7z0"
       }
    ]
}
