{
    "team_name": "WhisperNode ü§ê",
    "team_logo": "https://github.com/irisnet/iob-registry/raw/main/relayers/WhisperNode/images/WhisperNode.png",
    "contact": {
        "website": "https://whispernode.com",
        "github": "https://github.com/whispernode",
        "twitter": "https://twitter.com/whispernode",
        "discord": "https://discord.gg/4E5KZsRtjE",
        "telegram": "https://t.me/team_whispernode"
    },
    "introduction": [
        "WhisperNode is a community validator & infrastructure provider. Consider supporting our IBC relaying efforts by delegating to our validator nodes."
    ],
    "addresses": [
        {
            "akashnet-2": "akash1ryq6zncdxpdnnwhn9h24ar48ap9zkqgl5xpdnk",
            "cosmoshub-4": "cosmos1ryq6zncdxpdnnwhn9h24ar48ap9zkqgleav22v"
        },
        {
            "akashnet-2": "akash1ryq6zncdxpdnnwhn9h24ar48ap9zkqgl5xpdnk",
            "osmosis-1": "osmo1ryq6zncdxpdnnwhn9h24ar48ap9zkqgl3xl6u7"
        },
        {
            "axelar-dojo-1": "axelar1ryq6zncdxpdnnwhn9h24ar48ap9zkqglan6zpd",
            "cosmoshub-4": "cosmos1ryq6zncdxpdnnwhn9h24ar48ap9zkqgleav22v"
        },
        {
            "axelar-dojo-1": "axelar1ryq6zncdxpdnnwhn9h24ar48ap9zkqglan6zpd",
            "injective-1": "inj1jszj9xyh2eh8lx25u88rsv7hmsytvwsvr6cne0"
        },
        {
            "axelar-dojo-1": "axelar1ryq6zncdxpdnnwhn9h24ar48ap9zkqglan6zpd",
            "canine-1": "jkl1ryq6zncdxpdnnwhn9h24ar48ap9zkqglqrzmnn"
        },
        {
            "axelar-dojo-1": "axelar1ryq6zncdxpdnnwhn9h24ar48ap9zkqglan6zpd",
            "neutron-1": "neutron1ryq6zncdxpdnnwhn9h24ar48ap9zkqglaz9gst"
        },
        {
            "axelar-dojo-1": "axelar1ryq6zncdxpdnnwhn9h24ar48ap9zkqglan6zpd",
            "osmosis-1": "osmo1ryq6zncdxpdnnwhn9h24ar48ap9zkqgl3xl6u7"
        },
        {
            "axelar-dojo-1": "axelar19kzuzfmmy9wjr3cl0ss8wjzjup9g49hqzxn3p9",
            "secret-4": "secret1xpgjd2akpc8gmwez25keftpmlgs4aa3un463s7"
        },
        {
            "axelar-dojo-1": "axelar1ryq6zncdxpdnnwhn9h24ar48ap9zkqglan6zpd",
            "stride-1": "stride1ryq6zncdxpdnnwhn9h24ar48ap9zkqgl6kvk7q"
        },
        {
            "cheqd-mainnet-1": "cheqd1ryq6zncdxpdnnwhn9h24ar48ap9zkqglhlq2pa",
            "osmosis-1": "osmo1ryq6zncdxpdnnwhn9h24ar48ap9zkqgl3xl6u7"
        },
        {
            "cosmoshub-4": "cosmos1ryq6zncdxpdnnwhn9h24ar48ap9zkqgleav22v",
            "injective-1": "inj1jszj9xyh2eh8lx25u88rsv7hmsytvwsvr6cne0"
        },
        {
            "cosmoshub-4": "cosmos1ryq6zncdxpdnnwhn9h24ar48ap9zkqgleav22v",
            "neutron-1": "neutron1ryq6zncdxpdnnwhn9h24ar48ap9zkqglaz9gst"
        },
        {
            "cosmoshub-4": "cosmos1ryq6zncdxpdnnwhn9h24ar48ap9zkqgleav22v",
            "osmosis-1": "osmo1ryq6zncdxpdnnwhn9h24ar48ap9zkqgl3xl6u7"
        },
        {
            "cosmoshub-4": "cosmos1ryq6zncdxpdnnwhn9h24ar48ap9zkqgleav22v",
            "secret-4": "secret1xpgjd2akpc8gmwez25keftpmlgs4aa3un463s7"
        },
        {
            "cosmoshub-4": "cosmos1ryq6zncdxpdnnwhn9h24ar48ap9zkqgleav22v",
            "stride-1": "stride1ryq6zncdxpdnnwhn9h24ar48ap9zkqgl6kvk7q"
        },
        {
            "injective-1": "inj1jszj9xyh2eh8lx25u88rsv7hmsytvwsvr6cne0",
            "neutron-1": "neutron1ryq6zncdxpdnnwhn9h24ar48ap9zkqglaz9gst"
        },
        {
            "injective-1": "inj1jszj9xyh2eh8lx25u88rsv7hmsytvwsvr6cne0",
            "osmosis-1": "osmo1ryq6zncdxpdnnwhn9h24ar48ap9zkqgl3xl6u7"
        },
        {
            "injective-1": "inj1jszj9xyh2eh8lx25u88rsv7hmsytvwsvr6cne0",
            "secret-4": "secret1xpgjd2akpc8gmwez25keftpmlgs4aa3un463s7"
        },
        {
            "injective-1": "inj1jszj9xyh2eh8lx25u88rsv7hmsytvwsvr6cne0",
            "stride-1": "stride1ryq6zncdxpdnnwhn9h24ar48ap9zkqgl6kvk7q"
        },
        {
            "canine-1": "jkl1ryq6zncdxpdnnwhn9h24ar48ap9zkqglqrzmnn",
            "osmosis-1": "osmo1ryq6zncdxpdnnwhn9h24ar48ap9zkqgl3xl6u7"
        },
        {
            "canine-1": "jkl1ryq6zncdxpdnnwhn9h24ar48ap9zkqglqrzmnn",
            "secret-4": "secret1xpgjd2akpc8gmwez25keftpmlgs4aa3un463s7"
        },
        {
            "neutron-1": "neutron1ryq6zncdxpdnnwhn9h24ar48ap9zkqglaz9gst",
            "osmosis-1": "osmo1ryq6zncdxpdnnwhn9h24ar48ap9zkqgl3xl6u7"
        },
        {
            "neutron-1": "neutron1ryq6zncdxpdnnwhn9h24ar48ap9zkqglaz9gst",
            "secret-4": "secret1xpgjd2akpc8gmwez25keftpmlgs4aa3un463s7"
        },
        {
            "neutron-1": "neutron1ryq6zncdxpdnnwhn9h24ar48ap9zkqglaz9gst",
            "stride-1": "stride1ryq6zncdxpdnnwhn9h24ar48ap9zkqgl6kvk7q"
        },
        {
            "osmosis-1": "osmo1ryq6zncdxpdnnwhn9h24ar48ap9zkqgl3xl6u7",
            "secret-4": "secret1xpgjd2akpc8gmwez25keftpmlgs4aa3un463s7"
        },
        {
            "osmosis-1": "osmo1ryq6zncdxpdnnwhn9h24ar48ap9zkqgl3xl6u7",
            "stride-1": "stride1ryq6zncdxpdnnwhn9h24ar48ap9zkqgl6kvk7q"
        },
        {
            "secret-4": "secret1xpgjd2akpc8gmwez25keftpmlgs4aa3un463s7",
            "stride-1": "stride1ryq6zncdxpdnnwhn9h24ar48ap9zkqgl6kvk7q"
        }
    ]
}
